{
  "schemaVersion": "1.0",
  "id": "arrays-001",
  "title": "Array-Grundlagen",
  "learningObjective": "Array-Indexierung sicher anwenden",
  "difficulty": "easy",
  "points": 10,
  "durationMinutes": 20,
  "solution": {
    "type": "text",
    "content": "Greife mit nullbasiertem Index auf Elemente zu."
  }
}